{
  "manifest_version": 1,
  "name": "connector-sharepoint",
  "version": "0.1.0",
  "type": "connector",
  "description": "SharePoint sites and OneDrive, indexed in place through Microsoft Graph. So far it signs in (app-only with Sites.Selected, and on behalf of a user); crawling comes next.",
  "publisher": "openhoard",
  "license": "Apache-2.0",
  "capabilities": ["read:metadata", "read:content", "source:crawl"],
  "network": ["login.microsoftonline.com", "graph.microsoft.com", "*.sharepoint.com"],
  "max_exposure": "full",
  "runtime": "process",
  "limits": { "memory_mb": 512, "timeout_s": 3600 }
}
