{
  "manifest_version": 1,
  "name": "connector-s3",
  "version": "0.0.1",
  "type": "connector",
  "description": "Reference connector for S3-compatible buckets (AWS S3, MinIO, R2).",
  "publisher": "openhoard",
  "license": "Apache-2.0",
  "capabilities": [
    "read:metadata",
    "read:content",
    "write:content",
    "source:crawl",
    "source:delta"
  ],
  "network": ["*.amazonaws.com"],
  "max_exposure": "full",
  "runtime": "process",
  "limits": { "memory_mb": 256, "timeout_s": 300 }
}
